"Model","Description","Key Considerations","Revenue Streams","Notable Examples"
"Open Source Ecosystem","Leveraging the Open Source model, businesses initiate projects with the intent to cultivate a community that contributes to and utilizes the software. Monetization strategies can include offering premium services or cloud solutions. An alternative approach involves creating tools that enhance the value of existing open-source projects.","Customer Profile: Highly technical, demanding a product that is community-driven and widely adopted. Business Strategy: Product-led growth with deep understanding and engagement of the open-source community. Challenges: Authentic open-source engagement is critical and cannot be superficially contrived.","Licensing Subscription","MongoDB Elastic Docker"
"Infrastructure as a Service (IaaS)","This model involves the construction of a utility resource, widely demanded and typically billed on usage. Success hinges on providing cost-effective access or catering to emerging needs such as modern data center capabilities, which increasingly intersect with FinTech sectors.","Resource Intensity: Extensive back-end development, calling for exceptional engineering talent. Capital: Significant initial capital expenditure is likely required. Competitive Edge: Operational reliability and cost leadership are essential.","Metered billing","AWS Twilio Stripe Snowflake Cloudflare Visa OpenAI"
"Vertical Software as a Service (SaaS)","By identifying niche business challenges, Vertical SaaS aims to streamline workflows, enhance management, and minimize errors. The goal is to optimize operational cost structures, bolster risk management, and potentially elevate revenues within specific industries.","Market Saturation: Many large, recognizable verticals may already be heavily targeted. User Engagement: Difficulties in achieving product stickiness and customer reliance. Service vs. Product Dilemma: Tendency towards service provision due to high demand for customization and support.","Subscription","Procore Appfolio Toast MindBody"
"Developer Tools","Catering primarily to software developers, this model is a unique blend of open source, IaaS, and workflow solutions. It showcases many similarities to Vertical SaaS, but is distinctive due to its focus on a highly technical user base.","User Expectations: Developers demand cutting-edge tools that necessitate a sophisticated technical support infrastructure. Community Engagement: Establishing and nurturing a developer community is both critical and challenging.","Freemium offerings Subscription Metered billing","GitHub HuggingFace HashiCorp"
"Government Solutions","Targeting the public sector, businesses offer tailored solutions to governmental departments including defense, law enforcement, immigration, and education.","Sales Dynamics: Navigating a complex sales process fraught with bureaucratic entrenchment requires insider knowledge. Contractual Framework: Engagements might extend to project-specific or ongoing subscription-based contracts.","Subscription Per-project billing","Anduril SpaceX"
"Business-to-Business (B2B) Services","This model provides bespoke services, potentially masquerading as tailor-made solutions, including access to relationships (e.g., investment banking), specialized knowledge (e.g., consulting), or liability outsourcing (e.g., audit services).","Disruption Risk: Specialized knowledge services are susceptible to disruption by advanced learning models (LLMs). Defensive Tactics: Fostering relationships and persuasive skills may offer defensive benefits.","Per-project fee Retainer agreements","McKinsey PwC Accenture Various Investment Banks"
"Data and Information Commerce","Entities trade in unique, intricate, or rapidly evolving data sets, packaging this information accessibly, such as through APIs or structured repositories.","Usage Monitoring: Difficulty in tracking utilization and promoting API adoption. Data Management: Enforcing data erasure post-contract is problematic. The industry is heavily litigated.","Data set provision Metered usage","Mapbox Bloomberg Dun & Bradstreet CoreLogic Nielsen Thomson Reuters Cherre"
"Aggregator Platforms","Aggregators appeal to specific user bases or industry segments, offering insights, reviews, or educational content. They monetize through vendor referrals or marketplaces, earning fees on leads or transactions.","Market Evolution: Changing SEO landscapes and the rise of advanced algorithms (such as LLMs) affect the aggregator model's efficacy. Customer Acquisition: The need to allocate a portion of margins to draw and retain customers.","Advertising Transactional fees","Zillow Google Expedia Reddit SoftwareAdvice FindTheBest WikiHow Bankrate"
"Freemium SaaS","Businesses offer a basic version of their software for free. Monetization is achieved by later converting users to a paid model, often within a professional context.","Feature Balance: Challenging to delineate between free and premium offerings without alienating the free user base. Premium Conversion: Essential to entice a substantial proportion of users to premium plans.","Advertising Subscription","Slack Discord Substack Gmail / GDocs Zoom Dropbox"
"Online Marketplaces","Facilitating the exchange of products or services, online marketplaces address trust, regulatory, or logistical barriers that have historically hindered liquidity in certain realms.","Dual Front Battles: Marketplaces must simultaneously appeal to both buyers and sellers. Competitive Strategy: In the face of adversaries, establishing marketplace dominance may necessitate extensive financial outlay.","Transaction fees","Airbnb Uber eBay StubHub"
"Social Networking Platforms","Social networks serve the demand for digital communal spaces, whether for content creation, interaction, or a hybrid of both.","User Base Growth: Attracting and retaining a critical mass of users presents persistent challenges. Regulatory Navigation: Handling acquisitions and governance amidst diverse legal landscapes.","Advertising Premium user experiences","Facebook TikTok Instagram Strava"
"Entertainment Services","This model encompasses a broad spectrum of personal and social entertainment experiences, focused on engaging users and fostering repeat engagement, with the potential for entertainers to become generational cultural fixtures.","Creative Dynamics: Interaction with artists and copyright management poses significant risks. Market Predictability: Anticipating success in the entertainment industry can be highly speculative.","Subscriptions Pay-per-experience models","Spotify Netflix Disney Music Festivals Movie Theaters"
"Consumer Products","The traditional product model spans physical goods that address functional, aesthetic, or status-driven consumer needs, though there's a growing shift towards subscription-based arrangements.","Customer Expectations: Differentiation remains a hurdle with the prevalence of similar or imitation products. Brand & Loyalty: Significant investments in brand development and customer loyalty are imperative.","Per-unit sales Subscription models","Apple Tesla Garmin Amazon(ish) Ring"